Testimonio Leucodistrofia Metacromática (LMD);;                                  Tener una enfermedad de baja incidencia representa ser una persona rara, que a menudo los profesionales de la salud te miren con curiosidad, la gente te compadezca y te mire con pena y la administración te ignore porque no hay recursos para personas así.                       Padezco Leucodistrofia Metacromática (LMD), una enfermedad del metabolismo hereditaria poco frecuente. El mío es el único caso en personas adultas del que se tiene conocimiento de esta enfermedad neurodegenerativa para la que actualmente no hay tratamiento.                       Llegar al diagnóstico fue muy complicado y penoso. Mis capacidades disminuían, tenía dificultades primero para estudiar y posteriormente para trabajar, problemas de concentración, lentitud al hablar, dificultades en la marcha…                       Fuimos a muchos médicos. Algunos restaron importancia a los problemas y otros lo atribuyeron a trastornos mentales por lo que estuve más de 20 años catalogado de enfermo mental y medicado para decenas de patologías de esta índole sin que hubiese mejora en mi estado de salud.                       Una crisis de epilepsia que me dejó en coma vino a arrojar luz a mi situación. Recibí asistencia en el Hospital de Mataró de Barcelona. Allí los médicos miraron más allá, no se dejaron confundir por el diagnóstico confuso con el que llegué y me diagnosticaron de LMD. En tan solo un día tuvieron la sospecha y en tres días, después de practicar las pruebas oportunas, la confirmación.                       Esto me hace seguir confiando en los médicos a los que sólo pido que no se dejen llevar por primera impresiones y traten de ir más allá, que escuchen a los pacientes. La enfermedad, además de las graves crisis de epilepsia que he padecido y que han puesto en peligro mi vida, ha afectado mi capacidad cognitiva. Tengo importantes pérdidas de memoria, dificultades para expresarme y problemas para orientarme en tiempo y espacio. Necesito el apoyo continuo de una tercera persona para realizar mis actividades diarias.                       La sociedad y el sistema sanitario no están preparados para atender a una persona de mis características. Necesito rehabilitación cognitiva, entrenar mi cerebro y mantenerlo activo para evitar una degeneración más rápida. No ha sido fácil encontrar servicios así, que están principalmente dirigidos a personas mayores afectadas de Alzheimer.                       Mi familia buscó mucho, se informó por todos los medios a su alcance y ante la falta de recursos existentes me diseñó un programa de estimulación casero y desde el desconocimiento de personas no profesionales. Finalmente accedimos a un programa piloto en el Hospital Antiguo de Mataró a partir de una plataforma tecnológica de rehabilitación cognitiva. Una vez más el programa no estaba pensado para mí. No cabía en el programa porque estaba orientado a personas con accidentes cerebrales. Pero accedí gracias al empeño de mi neuróloga. Contra todo pronóstico el resultado fue positivo, mejoré, lo que nos animó a seguir buscando una vez finalizado el programa.                       Actualmente sigo un programa en la Asociación catalana de afectados de traumatismo craneoencefálico y daño cerebral adquirido (TRACE). Comparto muchos problemas, características y condiciones con este tipo de personas y en la entidad me han dado cobijo a pesar de no ser una persona afectada por un traumatismo.                       En mi caso los recursos y las ayudas vienen siempre de la iniciativa privada. El sistema público no tiene recursos para mí, aseguran que no existen. Los médicos que me tratan tienen muy buena voluntad, son considerados, me ofrecen todo tipo de consejos y ayudas y apoyan las acciones que llevamos a cabo para mantener mi estado de salud. Pero desgraciadamente no pueden ayudarme, no existen recursos. Además el desconocimiento, por la falta de precedente o referente, hace que tengamos importantes lagunas o dudas sobre el futuro.                       Y además la crisis. Los recortes en materia de salud que lleva a cabo el Govern de la Generalitat de Catalunya me han obligado a cambiar de neurólogo. El centro en el que me trataban, donde me diagnosticaron la enfermedad, no me pertenece por razones de residencia, geográficas, y he tenido que cambiar. Creo que la administración debería tener más en cuenta las necesidades de los pacientes y no tratarnos a todos con plantillas estancas, cajones en los que cabes o no cabes. Porque yo no quepo en ninguno. La vida nos enseña a todos a ser flexibles, saber que las cosas no son blancas o negras. Pero nuestros dirigentes no se han dado cuenta de que hay personas con necesidades especiales, que no encaja en la plantilla que ellos se han hecho, que han diseñado en un despacho.                       Tengo reconocido un grado de dependencia severo pero no percibo ninguna ayuda por la llamada Ley de Dependencia. No requiero ayuda física, fisioterapia o que me ayuden en la higiene. Entonces no hay nada. Sólo una ayuda para el ingreso en un centro asistencial en el que no se trabaje en mi mantenimiento sino en el que me aparquen durante unas horas. Me aseguran que no hay centros especializados en este tipo de enfermedades pero yo creo que sí. De hecho estoy seguro porque los he visitado. Una vez más la burocracia.                       Lo que más he aprendido a valorar a partir de mi situación es la ayuda que de manera desinteresada me presta la gente. Cosas mínimaas a las que antes ni prestaba atención. Las llamadas telefónicas de los amigos para saber cómo estoy, la sonrisa de mi profesora de yoga cuando hago bien un ejercicio, salir a comer un fin de semana con mi familia o el apoyo incondicional de mi entorno que, sin restar importancia a mi situación, sabe restar trascendencia a mis problemas y hacer más fáciles las dificultades con las que me encuentro día a día. No me gusta que las personas se compadezcan de mí. Yo tengo unas condiciones diferentes a los demás pero todos tenemos características específicas que nos hacen únicos y cada uno tenemos que jugar con las cartas que tenemos.                       Mi vida no es como la de los demás, como la de las personas de mi edad, pero soy feliz. Dicen que lo que no nos mata nos hace más fuertes y a mí de momento la LMD no me ha matado pero me ha hecho más fuerte, mucho más fuerte para plantarle cara, aprender a vivir con ella pero vigilante y amenazándola constantemente con ganarle la partida.                     a class="gestion-radio" href="https://www.somospacientes.com/enfermedades-raras" style="color: #fff; position: relative; font-weight: 600; background: #f1712f; padding: 5px 20px; right: 0.5%; margin-top: -30px; float: right;" target="_blank">           Radio Online          /a>                                                       style="color:#fff;;">      span>       Este sitio web utiliza cookies propias y de terceros para adaptarse a sus preferencias y realizar análisis. Al continuar navegando acepta nuestra Política de Cookies. +Info en       a href="http://enfermedades-raras.org/index.php?option=com_content&amp;view=article&amp;id=4458" id="cookieMessageDetailsLink" title="Ver nuestra política de privacidad">        política de privacidad       /a>       .      /span>      span class="cookie_button" id="continue_button" onclick="SetCookie('cookieAcceptanceCookie','accepted',9999);">       Aceptar      /span>     
Testimonio sobre la fiebre mediterránea familiar;;                                  Buenas noches, Tengo 33 años y hace 10 años fui diagnosticada como enferma de fiebre mediterránea familiar, lo que significa que llevo 10 años medicada pero realmente no ha sido hasta esta semana que a mi padre le han hecho las pruebas de genética y ha dado productor de fiebre mediterránea familiar en homocigosis, hace dos años cuando me las hicieron a mí, no eran concluyentes porque no se habían hecho las pruebas ninguno de mis padres, yo tenía el gen alterado en heterocigosis.                       Hoy por fin ha ido mi padre al médico ha contarle el caso a su médico de cabecera para que le puedan tratar, yo aunque sólo llevo 10 años tratada, llevo 23 años enferma, las crisis cada vez son peores, he tenido ya que darme de baja en dos ocasiones porque aunque esté inflamadísima y con fiebre voy al trabajo. Yo soy una persona fuerte y no dejo que nadie se apiade de mí y mucho menos me voy a dejar abandonar a la enfermedad, por eso, intento seguir con mi vida normal, voy al gimnasio de lunes a domingo, a mi trabajo de lunes a viernes y a mi universidad lunes y miércoles, cuando las crisis son acompañadas de vómitos, tengo que darme de baja, pero mientras no sea así, seguiré con mi vida.                       Tomo una colchicina diaria, la tengo puesta de por vida, no puedo dejar de tomarla y tampoco bajar la dosis porque recaigo. Me van a hacer un consejo de genética, sobre todo por si algún día quiero tener hijos, van a hacerse ahora las pruebas a mis hermanos, me tienen que hacer un árbol genealógico y por lo visto reunirán a los hermanos de mi padre (3 de los cuales tienen síntomas) para tratarlos o hacerles pruebas.                       Quiero que esto sirva de ejemplo para las personas que estén enfermas, sé que no se tiene calidad de vida, pero no hay que estar lamentándose de lo mucho que te duele...hay que mantenerse ocupado para no pensar en lo que puede pasar, porque sino...no vives.                       Con esto, me gustaría que si tienen hijos que estén enfermos, por favor, hacedles fuertes y si el enfermo eres tú, hazlo por ti. Ya se sabe que esto es una enfermedad degenerativa, no tiene cura y cada vez son peores las crisis (por lo menos en mi caso), pero eso no significa que puedas ser feliz y hacer que tu vida sea normal. Un saludo                     a class="gestion-radio" href="https://www.somospacientes.com/enfermedades-raras" style="color: #fff; position: relative; font-weight: 600; background: #f1712f; padding: 5px 20px; right: 0.5%; margin-top: -30px; float: right;" target="_blank">           Radio Online          /a>                                                       style="color:#fff;;">      span>       Este sitio web utiliza cookies propias y de terceros para adaptarse a sus preferencias y realizar análisis. Al continuar navegando acepta nuestra Política de Cookies. +Info en       a href="http://enfermedades-raras.org/index.php?option=com_content&amp;view=article&amp;id=4458" id="cookieMessageDetailsLink" title="Ver nuestra política de privacidad">        política de privacidad       /a>       .      /span>      span class="cookie_button" id="continue_button" onclick="SetCookie('cookieAcceptanceCookie','accepted',9999);">       Aceptar      /span>     
Testimonio "ER van al cole" Sandra Beltrán ;;                                  Con muchísima emoción, llena de alegría y gozo salí esta mañana de mi casa a lo que llame "mi obra del día".                       Le escribí un mensaje a mi esposo diciéndole que le dedicaba mi voluntariado de hoy a el y a mi hijo Santiago, y con ese amor me fui a contar el cuento de Federito a los niños del Colegio Blasco Ibáñez en Fuenlabrada, tal y como me lo encomendaron las que yo llamo "hadas de FEDER", es decir María y Alba (Tome y Ancochea respectivamente).                       Y les digo sinceramente que vuelvo a casa que rebozo de alegría y emoción. La actividad fue todo un éxito en mi criterio y es el fruto de un trabajo coordinado y en equipo.                       Empecé por presentarme y decirles a lo que venia hoy y en nombre de quien venia. Les explique que es y que hace Feder y seguido les explique la razón por la cual algunas enfermedades se denominan raras. Hablamos de lo que era "común o frecuente" y lo que era "raro", e igualmente les explique por que dentro de la diferencia seguimos siendo iguales.                       La actividad esta muy bien preparada. Les explique lo que íbamos a hacer y como iban ellos a participar.Los niños se mostraron interesados desde el principio.                       Cuando hablamos de enfermedades todos querían contarme que alguien de su familia estaba enfermo, incluso un nino me dijo que el tenía colesterol y me pregunto que si eso era raro, jaja. Le explique el Criterio que usamos los adultos para llamar a algo "raro" y entonces todos lo entendieron muy bien.  Sentí que los niños todos estaban ya sensibilizados con el tema. Sentí que ellos por ser niños están mas cerca de lo que es natural en los humanos pero que los adultos olvidamos cuando crecemos; los ninos estan mas cerca del interés por el otro, mas cerca de la compasión  y la integración. Ellos ya se preocupan por la salud de los demás. Somos nosotros los adultos los que excluimos con nuestros juicios a quienes no encajan en ellos.                       Los profes estuvieron todos Super Super interesados en toda la actividad. Colaboraron, actuaron, fueron técnicos de iluminación de nuestro teatro apagando y encendiendo las luces cuando yo se los pedía.  Preguntaban que si podíamos ir a contar esta historia en otros colegios, que si podíamos hacerla en otros salones.  Todos dijeron que les había gustado la actividad, que había enganchado a los niños con el cuento y que lo habían disfrutado mucho.                       Yo no tengo palabras para decirles lo hermoso, gratificante, abrumador, especial que fue esta actividad!  Para mi fue lo máximo! Para mi es un Super premio! Actividades como esta le dan un valor y un significado Super positivo a mi propia experiencia como madre de un nino con una ER, pero sobre todo le dan una maravillosa utilidad.                       Yo me siento plena. Los niños me dejaron llena de sonrisas. De su compromiso de ir a contarle a sus padres lo que hicimos en clase y de hacer el dibujo para el concurso.                       Todos querían contarme de sus vidas después de la actividad. Contarme de alguna enfermedad que habían tenido  ellos o un amigo o la abuela ; querian contarme de sus vidas. Una niña se acerco a mi a decirme que hoy había sido el mejor día de su vida! ... Yo alucine con ella!                       Otro niño dijo "Sandra yo soy diferente" y cuando le pregunte que por que me respondió: " porque soy marrón". Era un nino de piel oscura, el único en clase. Y con mi mejor sonrisa le dije que era diferente por el color pero igual por un millón de cosas mas! Le dije que lo importante era como se sentía el por ser diferente en el colegio, y me dijo que se sentía bien. Lo cual me alegro.                       No se que mas decirles, solo puedo agradecerles por haberme hecho parte de este proyecto tan hermoso. Se que el mensaje llego! Lo vi y lo viví! Y se que esto es un grano de arena para transformar la vida de tantos niños con ER.                       Proyectos como estos son los que vale la pena financiar porque son los que construyen conciencia y salud; porque muchas veces, y lo he visto, lo que termina siendo determinante en el desarrollo y la vida o la muerte de un nino con una enfermedad rara, no es la enfermedad en si, sino como lo tratamos todos por tenerla.  Mientras haya inclusión e integración, aceptación, compasión y colaboración para estos niños, tendrán mas oportunidad de vivir.                       Nuevamente gracias eternamente, a FEDER a Johnson &amp; Johnson / Janssen y a quienes han hecho esto posible. Los felicito a todos !!!                     a class="gestion-radio" href="https://www.somospacientes.com/enfermedades-raras" style="color: #fff; position: relative; font-weight: 600; background: #f1712f; padding: 5px 20px; right: 0.5%; margin-top: -30px; float: right;" target="_blank">           Radio Online          /a>                                                       style="color:#fff;;">      span>       Este sitio web utiliza cookies propias y de terceros para adaptarse a sus preferencias y realizar análisis. Al continuar navegando acepta nuestra Política de Cookies. +Info en       a href="http://enfermedades-raras.org/index.php?option=com_content&amp;view=article&amp;id=4458" id="cookieMessageDetailsLink" title="Ver nuestra política de privacidad">        política de privacidad       /a>       .      /span>      span class="cookie_button" id="continue_button" onclick="SetCookie('cookieAcceptanceCookie','accepted',9999);">       Aceptar      /span>     
Enfermedad de Sandhoff;;                                  Hola, en 2005 fui padre por segunda vez, tuve una niña guapisima,ANDREA, una niña muy buscada ya que, teníamos un niño de 5 años y nuestra alegría era inmensa,yo tenía por entonces 29 años y  mi mujer 27, sin ningun problema,y toda una vida para poder difrutar de nuestros hijos, todo se empezó a truncar cuando a los 6 meses, comenzamos a notar que nuestra hija no crecía con el mismo desarrollo que lo había echo nuestro otro hijo, los médicos no sabían porque, un médico privado sólo nos dijo que tenía un gran retraso y que nos tocaría luchar mucho por ella, se no cayó el mundo encima, recuerdo que ese día nos abrazamos, lloramos y todo aquella vida perfecta se trunco en un minuto, sin saber lo que todavía no sabiamos, comenzamos  a luchar, visitamos hasta 3 hospitales distintos, hablamos con los  mejores médicos, llevamos a nuestra hija a los mejores fisios para que trabajasen con ella, hasta que despues de muchas pruebas nos dijeron  que tenía la enfermedad de SANDHOFF, dos casos en España y que desafortunadamente el desenlace sería la muerte de mi hija, ese día cambio mi vida para siempre, comenzamos una lucha, ANDREA comenzó una lucha por querer vivir, disfrutabamos con ella cada momento, haciamos todo por ella, intentando que no fuera verdad aquello que nos dijeron,jamás llegue a oirla decir papá, pero solo un gesto, una sonrisa, un aprentón con su mano mi dedo era una felicidad, una ternura,inexplicable.                       Sus últimos 4 meses fueron en un hospital y creo que nunca podre aprender mas que aquellos meses, de lucha de superación, de vida, cuando paso lo inevitable el 18 de diciembre de 2006, cuando la vi morir en mis brazos, aquel día se convirtió en un ANGEL, un angel que ahora nos ayuda, que ayuda a su hermano que la  tiene presente a su otra hermana que nació después y que sin conocerla, habla de su hermana, me gustaría poerles contar nuestra experiencia,  mi mujer está escribiendo un libro que es digno de leerlo y junto con  ella nos gustaria poder ayudar a otras familias, con nuestra experiencia y poderles ayudar a continuar viviendo, gracias un fuerte abrazo                     a class="gestion-radio" href="https://www.somospacientes.com/enfermedades-raras" style="color: #fff; position: relative; font-weight: 600; background: #f1712f; padding: 5px 20px; right: 0.5%; margin-top: -30px; float: right;" target="_blank">           Radio Online          /a>                                                       style="color:#fff;;">      span>       Este sitio web utiliza cookies propias y de terceros para adaptarse a sus preferencias y realizar análisis. Al continuar navegando acepta nuestra Política de Cookies. +Info en       a href="http://enfermedades-raras.org/index.php?option=com_content&amp;view=article&amp;id=4458" id="cookieMessageDetailsLink" title="Ver nuestra política de privacidad">        política de privacidad       /a>       .      /span>      span class="cookie_button" id="continue_button" onclick="SetCookie('cookieAcceptanceCookie','accepted',9999);">       Aceptar      /span>     
Charcot Marie Tooth;;                                  Hola a todos/as, soy una chica con Charcot Marie Tooth. Me gustaría subir un escrito que ya escribí hace un tiempo y en el cual he querido reflejar como me siento al tener esta enfermedad. Gracias. Maggie, quién permanecía ahí sentada, rodeada por aquellos barrotes de hierro, se le acercó Tom. -Hola- le dijo. Y entonces fue cuando se dio cuenta de la masacre que tenía dibujada en su cara -¿Qué te han hecho?- le preguntó atemorizado Tom. -Nada. Simplemente castigarme por ser inocente, cortarme las alas, y hacer que cada vez que me despierte deje de pensar en que soy libre. Incapaz de recorrer aquellos verdes e inmensos prados de un lado a otro como una niña pequeña. -Y lo peor de todo ¿sabes qué es?- volvió a decir Maggie con la voz casi apagada y mirándole a los ojos. -Que cada vez ese sueño está más lejos, y solo dejará de aparecer cuando yo esté muerta. -No digas eso- le dijo Tom. Yo... Maggie le interrumpió. -Déjalo. ¿Me lo has traído? Porque ahora más que nunca lo único que puedo hacer es escribir demostrando mi gran habilidad como escritora. -Sí, toma. El piano dejó de sonar, y la brújula cambió por completo su dirección... -Maggie, ¿por qué no sigues escribiendo?- le preguntó preocupado Tom. Entonces Maggie dejó caer el bolígrafo y sus lágrimas se asomaron deslizándose por su cara. Cayendo de una en una sobre el papel. E incluso algunas de ellas al chocar se convertían en hielo, reflejando realmente su historia.                     a class="gestion-radio" href="https://www.somospacientes.com/enfermedades-raras" style="color: #fff; position: relative; font-weight: 600; background: #f1712f; padding: 5px 20px; right: 0.5%; margin-top: -30px; float: right;" target="_blank">           Radio Online          /a>                                                       style="color:#fff;;">      span>       Este sitio web utiliza cookies propias y de terceros para adaptarse a sus preferencias y realizar análisis. Al continuar navegando acepta nuestra Política de Cookies. +Info en       a href="http://enfermedades-raras.org/index.php?option=com_content&amp;view=article&amp;id=4458" id="cookieMessageDetailsLink" title="Ver nuestra política de privacidad">        política de privacidad       /a>       .      /span>      span class="cookie_button" id="continue_button" onclick="SetCookie('cookieAcceptanceCookie','accepted',9999);">       Aceptar      /span>     
