"Dar la vida a la vida", un cuento sobre las pequeñas acciones;;                                  Desde nuestro Servicio de Atención Psicológica, queremos compartir con todos vosotros este bellísimo cuento sobre la importancia de sensibilizar con las pequeñas acciones y sobre cómo, pequeños montoncitos de arena, terminar por formar una montaña. El autor de este relato es José María Doria, recogido en su libro "Relatos eternos".                                                                       En un lejano paraje de sol y de paz, se hallaba un escritor de nombre Cronom que vivía junto a un pequeño poblado de pescadores. Su vida era tranquila y de todos era conocido que gozaba del respeto y la estima de las personas que lo conocían.                                                Cronom, amante de los silencios y de la contemplación de la naturaleza, todas las mañanas solía caminar al alba por la orilla del mar, observando el disco solar que pleno de vida y fuerza le enviaba las más bellas inspiraciones.                                                Sucedió que un día, aparentemente como todos, encontrándose paseando por aquella desierta playa, de pronto, divisó a una joven que, por sus movimientos, parecía estar bailando sobre la orilla. Poco a poco, conforme se fue acercando, comprobó que se trataba de una hermosa muchacha que recogía las estrellas de mar que hallaba en la arena y, las devolvía al Océano con gracia y ligereza.                                                "¿Por qué hace eso?" Preguntó el escritor un tanto intrigado.                                                "¿No se da usted cuenta?" Replicó la joven. "Con este sol de verano, si las estrellas se quedan aquí en la playa, se secarán y morirán."                                                El escritor no pudiendo reprimir una sonrisa, contestó:                                                "Joven, existen miles de kilómetros de costa y centenares de miles de estrellas de mar... ¿Qué consigue con eso? Usted sólo devuelve unas pocas al océano".                                                La joven tomando otra estrella en su mano y mirándola fijamente, dijo:                                                "Tal vez, pero para ésta ya he conseguido algo..." y la lanzó al mar. Al instante le dedicó una amplia sonrisa y siguió su camino.                                                Aquella noche, el escritor no pudo dormir... Finalmente cuando llegó el alba, salió de su casa, buscó a la joven a lo largo de aquella playa dorada, se reunió con ella y, sin decir palabra, Comenzó a recoger estrellas y devolverlas al mar.                                                Última actualización: 4 de diciembre de 2017.                                            a class="gestion-radio" href="https://www.somospacientes.com/enfermedades-raras" style="color: #fff; position: relative; font-weight: 600; background: #f1712f; padding: 5px 20px; right: 0.5%; margin-top: -30px; float: right;" target="_blank">           Radio Online          /a>                                                       style="color:#fff;;">      span>       Este sitio web utiliza cookies propias y de terceros para adaptarse a sus preferencias y realizar análisis. Al continuar navegando acepta nuestra Política de Cookies. +Info en       a href="http://enfermedades-raras.org/index.php?option=com_content&amp;view=article&amp;id=4458" id="cookieMessageDetailsLink" title="Ver nuestra política de privacidad">        política de privacidad       /a>       .      /span>      span class="cookie_button" id="continue_button" onclick="SetCookie('cookieAcceptanceCookie','accepted',9999);">       Aceptar      /span>     
La ER «nos ha cambiado a la familia entera»;;                                    Ella le mira a los ojos y sonrie, hace tiempo que le cuesta sonreir; pero esa tarde con la luz del atardecer a él le brillaban los ojos y también sonreia a su manera. Existen ciertas playas en las que a veces, se para el tiempo aunque sea para tomar instantaneas que guardas como regalos.                                   Y es que las playas, a veces, reconocen a esos faros tan especiales y les dan un poquito más de luz para que sigan iluminando a esas personas que les aman.                       Otras veces, lo supranuclear progresivo intenta arrebatar estos momentos, pero por suerte, siempre hay un motivo para sonreir bajo la luz del atardecer y esta historia de amor sigue transformándose.                       ¿Qué es la parálisis supranuclear progresiva? El término científico siempre lo podéis buscar en la Wikipedia...Pero quiero hablar desde mi experiencia personal con la parálisis supranuclear y mi padre.                       Lo que voy a escribir a continuación lo hago con la intención de visibilizar esta enfermedad que prácticamente nadie conoce e intentar crear conciencia sobre ella. Voy a empezar poniendo un ejemplo muy simple: Imagina que te estás comiendo tu comida favorita, la estás saboreando y disfrutando de ella y de repente de un día para otro te dicen que con el tiempo esa comida va a dejar de existir como tal. Pues eso es, lo que le ha pasado a mi padre, está claro que ahí todo es más complicado que el simple ejemplo de tu comida favorita.                       La enfermedad no sólo ha cambiado a mi padre, nos ha cambiado a la familia entera. Cada día, desde hace siete años, y cada vez se hace más complicado, tenemos (porque queremos) que hacer frente a la enfermedad. Día a día es una aventura nueva y todo lo que tiene que ver con los sentimientos de cada miembro de la familia. Hay días en los que te despiertas pensando: venga va, vamos a ello y otros días en lo que dices: qué mierda.                       Año tras año hemos visto a mi padre ir a menos. En la actualidad, él es una persona que necesita apoyo para todo:                       Para comer y todo lo que implica eso: darle cucharada a cucharada, respetando sus ritmos y aún así se atraganta con la comida en varias ocasiones, porque tiene disfagia avanzada y ello ocurre a pesar de que sus comidas sean trituradas y muy espesas; tampoco puede tomar líquidos (sólo si se les echa espesante). También para ir al baño, vestirlo y desplazamientos.                       Él ya no tiene coordinación motora, va en silla de ruedas. No puede hablar, nos comunicamos con él con algún gesto simple y cada vez cuesta más. No ve demasiado bien, de hecho es como si viera luces parpadeantes prácticamente todo el rato.                       Algunas veces se desorienta y no sabe donde está y se pone muy nervioso, por suerte de momento le pasa sólo en algunas ocasiones. Por las noches algunas veces se desvela y se pone nervioso también.                       Os preguntaréis...Pero ¿él es consciente de todo esto? La respuesta es si. No es consciente al 100% porque está enfermedad es neurodegenerativa, por lo que también le afecta algo a la parte cognitiva, pero no todas las áreas las tiene afectadas.                       Mi padre era médico; él mismo cuando empezó a tener algunos síntomas se autodiagnosticó antes de que los neurólogos le dieran los resultados. A día de hoy aún te sabe contestar con algún si o no a términos médicos,problemas politicos y algún que otro consejo, sólo lo puedes entender si haces un esfuerzo por entenderle.                       Pero en cambio, ya no entiende las bromas.                       Si, todo es muy raro, es una enfermedad que no se conoce y que la gente cuando le hablo de la enfermedad aún me pregunta si tiene cura; no señores y señoras no tiene cura y cada vez va a peor.                       A cada persona que tiene la enfermedad le afecta de una manera u otra, pero a mi padre le está afectando de esta manera. Hace un par de años mi padre aún no estaba tan mal e hizo el testamento vital, en el que decidió que no quiere que le pongan nada artificial para seguir viviendo. Sinceramente creo es una de las mejores decisiones que se pueden tomar. Por lo que cuando el metabolismo de mi padre diga hasta aquí, será hasta ahí.                       Mi madre ama a mi padre, lo quiso y lo quiere y por eso ella sufre mucho. Ella es la cuidadora principal de mi padre. Es muy difícil entenderla muchas veces porque hay ambivalencias continuamente, le cuesta aceptar, a veces, la realidad en la que vive. Es todo más complejo de lo que a simple vista aparenta. Por eso hay dias de todo. A pesar de ello admiro su valentía y su coraje por seguir adelante.                       Mi abuela, la madre de mi padre. Lo cuida como cuando era pequeño. Sus ojos se han vuelto a convertir en los de madre cuidadora.                       Mi hermana, no para de darle amor a mi padre y eso es lo que admiro de ella.                        Y en cuanto a mi, esta situación me parece una mierda porque no me gusta ver a mi padre de esta manera. Pero todos estos años me han hecho ser como soy ahora y me gusta haber sacado algo de todo esto: Aprovechar el hoy. El no preocuparme por cosas que la gente se suele preocupar, el saber dar y querer , el intentar comprender...                       No sabemos cuanto durará mi padre, pero lo que si que sabemos es que por el momento estamos con él.                                           a class="gestion-radio" href="https://www.somospacientes.com/enfermedades-raras" style="color: #fff; position: relative; font-weight: 600; background: #f1712f; padding: 5px 20px; right: 0.5%; margin-top: -30px; float: right;" target="_blank">           Radio Online          /a>                                                       style="color:#fff;;">      span>       Este sitio web utiliza cookies propias y de terceros para adaptarse a sus preferencias y realizar análisis. Al continuar navegando acepta nuestra Política de Cookies. +Info en       a href="http://enfermedades-raras.org/index.php?option=com_content&amp;view=article&amp;id=4458" id="cookieMessageDetailsLink" title="Ver nuestra política de privacidad">        política de privacidad       /a>       .      /span>      span class="cookie_button" id="continue_button" onclick="SetCookie('cookieAcceptanceCookie','accepted',9999);">       Aceptar      /span>     
«Un diagnóstico que tardó 34 años en llegar de forma casual»;;                                  Hola, mi nombre es Inma y tengo una enfermedad minoritaria llamada SKT (Síndrome de Klippel Trenaunay), os dejo varios enlaces por si queréis saber de ella. (            a href="https://goo.gl/yMNdJq">             https://goo.gl/yMNdJq            /a>            /            a href="https://goo.gl/YSovV6">             https://goo.gl/YSovV6            /a>            )                       Llegué a mi familia una mañana de viernes, en pleno comienzo del verano y aparentemente sana, 4.700 gr de felicidad para mis padres. Pero tenía en la pierna, lo que solían decir nuestras abuelas “un antojo”. La mancha vino de oporto característica de este síndrome. De pequeña solía estar malita muy a menudo, era un imán para cogerlo todo. Siempre baja de ánimo y con poquitas fuerzas.                       Conforme fui creciendo, mi pierna no quiso acompañarme y decidió ir por libre. Inocente y casi sin querer saber, solía ver a mis padres buscar apoyo en mil médicos. Ese nuevo día, en que íbamos a la consulta, yo ya sabía cómo acabaría. Acabaría como los anteriores, llenos de más dudas e impotencia. Mis padres, quizá, decidieron que era mejor, no darnos contra más puertas y dejar todo como estaba. Pero yo, aun siendo pequeña, pensaba que era imposible que unos señores tan listos pudieran saber tan poco. En mi pequeño interior luchaba por tener un diagnóstico, un apoyo, que no me soltaran tan pronto de la mano. Me mataba escuchar a los médicos, siempre las mismas frases «esto es lo que hay», y mi “favorita” «tú tranquila, si hay gente peor que tú». Al final sentía que los médicos habían dejado un peso muy grande en una niña tan pequeña.                       La pubertad fue el período detonante, donde esta enfermedad da realmente la cara. Los dolores en la pierna eran agotadores, como un peso que no podía quitarme de encima. Me hacían estar cansada, triste y al final de mal humor. Si le sumas todo ello a un periodo de la vida tan trascendente como es la adolescencia, el resultado son problemas psicológicos.                       Después de un largo caminar con mis problemas de salud, la casualidad quiso que un día tuviera suerte. Las piezas del puzle, iban apareciendo, colocándose en su sitio y al final formó con él un nombre, Síndrome de Klippel Trenaunay. Un diagnóstico que tardó 34 años en llegar y que lo hizo de forma casual. Mi enfermedad no tiene cura, solo tratamientos de control y paliativos, pero ponerle nombre fue un descanso para mí. Ahora llevo un control más estricto por los médicos y he aprendido a convivir con los síntomas.                       Pero la carga emocional pesa mucho y cuando se juntan tus dolencias con problemas laborales, familiares, etc. el vaso se desborda. Uno mismo quiere ser fuerte y solucionarlo todo, pero día a día te das cuenta que no remontas, que cada vez te cuesta más recuperarte de las recaídas, tanto físicas como emocionales, que la vida te ha dado malas cartas y no puedes cambiar de partida, ahí es cuando llega la depresión y tu enfermedad empieza a ser el centro de todo. Personalmente he de reconocer que hubo muchos días en que pensé que el mundo estaría mejor sin mí, o yo sin él, quién sabe. Dejas de hacer cosas que te gustan, dejas de salir, dejas de mirarte al espejo, dejas de sentir,… en definitiva dejas de vivir. Hay un punto de inflexión en mi vida algo que se rompió dentro de mí y que me dijo “ahora o nunca, necesitas apoyo para saber manejar tus emociones y dejar de ser una víctima de ti misma”. Porque al final somos nosotros mismos, nuestro peor enemigo. Así que decidí buscar ayuda psicológica. Le conté mi inquietud a un familiar y me puso en contacto con FEDER.                       Mi experiencia con FEDER ha sido un regalo inesperado. Gracias al apoyo del Servicio de Atención Psicológica, he adquirido herramientas que me están ayudando a comenzar un nuevo camino y dejar atrás lo pasado. He aprendido que cambiando mis pensamientos puedo cambiar la forma en que me siento. Gracias a ello puedo dormir mejor por las noches, y puedo ir superando mi ansiedad. He aprendido a mejorar mi relación conmigo misma y con los demás. He aprendido a decir NO, pero también a decir SI. “No”, a todo aquello que me hace daño y, “sí” a permitirme sentir cosas buenas.                       Muchas gracias a todas las personas y profesionales que, desinteresadamente, hacen posible que alguien tan pequeño como yo, sienta que tiene derecho a un hueco en este mundo y a hacer posible que encaje en él. Y personalmente dar las gracias a Magdalena, mi genio amarillo de la lámpara, que sin pedirlo, me concedió uno de los mejores deseos; querer seguir en el camino.                       Por eso animo a todos aquellos, que estén en una situación cercana a la mía, que se dejen ayudar. Al principio te desgasta emocionalmente. Pero al final sale todo lo malo, y es entonces cuando empieza a haber sitio para las cosas buenas.¡ Merece la pena!           style="text-align: right;">            Mis mejores deseos para todos y gracias por leerme.                     a class="gestion-radio" href="https://www.somospacientes.com/enfermedades-raras" style="color: #fff; position: relative; font-weight: 600; background: #f1712f; padding: 5px 20px; right: 0.5%; margin-top: -30px; float: right;" target="_blank">           Radio Online          /a>                                                       style="color:#fff;;">      span>       Este sitio web utiliza cookies propias y de terceros para adaptarse a sus preferencias y realizar análisis. Al continuar navegando acepta nuestra Política de Cookies. +Info en       a href="http://enfermedades-raras.org/index.php?option=com_content&amp;view=article&amp;id=4458" id="cookieMessageDetailsLink" title="Ver nuestra política de privacidad">        política de privacidad       /a>       .      /span>      span class="cookie_button" id="continue_button" onclick="SetCookie('cookieAcceptanceCookie','accepted',9999);">       Aceptar      /span>     
Crónica, desde la AEEG, de nuestra VIII Escuela;;                                  Han sido dos días intensos, fructíferos, llenos de reflexiones y llenos de optimismo y motivación. Estas jornadas de formación nos proponen mirar los retos de las asociaciones desde diferentes aspectos, que se complementan pero con la autonomía suficiente para poder abordarlos de manera diferenciada según nuestras necesidades y posibilidades.                       La ponencias nos han asesorado, con diferentes praxis, cómo podemos ir construyendo con acierto nuestra labor y no desfallecer ante las dificultades que nos encontremos al abordar nuestros objetivos. Cada ponente me ha ayudado a mirar los retos de mi asociación con realismo y determinación. Nos han proporcionado herramientas para ir consolidando cada asociación y para realizar, entre todos, actividades que mejoren nuestra situación.                       Vuelvo con información, ideas, ejemplos de buenas praxis para trasmitir, proponer y debatir en mi grupo de trabajo. Ilusionada porque hora sé que se puede, que cada paso cuenta y que hay poner en valor los logros, aunque sean pequeños, porque nos preparan para el siguiente paso. Doy las gracias a FEDER. Las personas de la federación que he conocido en esta escuela, me han facilitado su colaboración y me han ofrecido su asesoramiento, que considero fundamental para ir elaborando los proyectos que acometamos en la asociación.                       Los profesionales de CREER se han mostrado en todo momento amables y eficientes. Haciéndome sentir cómoda y atendida en todo momento. Gracias. Ha sido muy gratificante conocer a los representantes de las asociaciones que han participado en la escuela. Me habéis transmitido mucho entusiasmo y muchas ideas. Entre todos me habéis ayudado a llenar mi maleta de aprendizajes, de motivación y de ganas de volver a encontrarnos en la siguiente escuela.                      style="text-align: right;">            Isabel Morais de la Horra.                        Miembro de AEEG: glucogenosis V, enfermedad de McArdle.                                           a class="gestion-radio" href="https://www.somospacientes.com/enfermedades-raras" style="color: #fff; position: relative; font-weight: 600; background: #f1712f; padding: 5px 20px; right: 0.5%; margin-top: -30px; float: right;" target="_blank">           Radio Online          /a>                                                       style="color:#fff;;">      span>       Este sitio web utiliza cookies propias y de terceros para adaptarse a sus preferencias y realizar análisis. Al continuar navegando acepta nuestra Política de Cookies. +Info en       a href="http://enfermedades-raras.org/index.php?option=com_content&amp;view=article&amp;id=4458" id="cookieMessageDetailsLink" title="Ver nuestra política de privacidad">        política de privacidad       /a>       .      /span>      span class="cookie_button" id="continue_button" onclick="SetCookie('cookieAcceptanceCookie','accepted',9999);">       Aceptar      /span>     
